{
  "schema_version": "1.0.0",
  "generated": "2026-10-26",
  "source_repo": "midnghtsapphire/revvel-standards",
  "suggested_path": "docs/ml-assets/",
  "count": 25,
  "assets": [
    {
      "slug": "llama-cpp-gbnf",
      "name": "llama.cpp GBNF grammars + JSON-Schema-to-grammar",
      "category": "constrained-decoding",
      "url": "https://github.com/ggml-org/llama.cpp/blob/master/grammars/README.md",
      "extra_urls": [
        "https://github.com/ggml-org/llama.cpp"
      ],
      "license": "MIT",
      "kind": "inference engine + grammar format",
      "loop": "Deterministic",
      "what": "GBNF is llama.cpp's grammar format for constraining token sampling. It includes a converter from JSON Schema to GBNF. This is the engine underneath LM Studio's GGUF structured output.",
      "why": "For outputs that JSON Schema can't express well (WR titles like `[WR] <title>`, conventional-commit lines `feat:|fix:|docs:|chore:`, enum labels), a grammar enforces the house format at decode time. wr-lint.mjs then becomes a confirmation, not a correction.",
      "determinism": "Grammar constraints are exact (invalid tokens are masked). Combine with greedy decoding and a fixed seed for repeatable content on a fixed build.",
      "effort": "medium",
      "priority": "high",
      "adopt": [
        "Keep a small `grammars/` set (for example conventional-commit.gbnf, wr-title.gbnf) and use them via llama-server or LM Studio."
      ],
      "access_date": "2026-10-26"
    },
    {
      "slug": "lmstudio-structured-output",
      "name": "LM Studio Structured Output (json_schema)",
      "category": "constrained-decoding",
      "url": "https://lmstudio.ai/docs/developer/openai-compat/structured-output",
      "extra_urls": [],
      "license": "Docs: proprietary site, free to read. LM Studio app: proprietary freeware. lmstudio-python SDK: MIT",
      "kind": "official docs",
      "loop": "Deterministic",
      "what": "LM Studio's OpenAI-compatible /v1/chat/completions accepts `response_format: {type: json_schema, ...}`. For GGUF models it enforces the schema with llama.cpp grammar-based sampling, and for MLX models with Outlines.",
      "why": "LM Studio is already Layer 0 (docs/LOCAL_LLM_SETUP.md; scripts/local_llm.py default `http://127.0.0.1:1234/v1`). Passing a JSON Schema from schemas/ means local replies are schema-valid by construction. Today scripts/python_cuda/probabilistic_validator.py validates after the fact and retries.",
      "determinism": "Structural validity is guaranteed by the sampler. Content still depends on sampling, so set temperature 0 and a seed. The docs warn that models under 7B may struggle.",
      "effort": "low",
      "priority": "high",
      "adopt": [
        "Add an optional `schema=` argument to scripts/local_llm.py that sends `response_format` for the LM Studio and Ollama lanes.",
        "Keep probabilistic_validator as the second gate (defense in depth)."
      ],
      "access_date": "2026-10-26"
    },
    {
      "slug": "ollama-structured-outputs-seed",
      "name": "Ollama structured outputs (`format` JSON Schema) + `seed` option",
      "category": "constrained-decoding",
      "url": "https://docs.ollama.com/capabilities/structured-outputs",
      "extra_urls": [
        "https://ollama.com/blog/structured-outputs",
        "https://github.com/ollama/ollama"
      ],
      "license": "MIT",
      "kind": "official docs + runtime",
      "loop": "Deterministic",
      "what": "Ollama accepts a JSON Schema in the `format` field to constrain output, and an `options.seed` integer. Its Modelfile docs say a fixed seed makes the model generate the same text for the same prompt.",
      "why": "Ollama is the second Layer 0 lane in scripts/local_llm.py (OLLAMA_ENDPOINT, default model gemma3). Same win as LM Studio: schema-valid local output, plus a seed to record in the provenance ledger.",
      "determinism": "Seed + temperature 0 + the same model digest and hardware gives repeatable output in practice. Not guaranteed across Ollama versions or hardware (see batch-invariant-ops).",
      "effort": "low",
      "priority": "high",
      "adopt": [
        "Send `format=<schema>` and `options:{seed, temperature:0}` from local_llm.py. Log the model digest from /api/tags with each call."
      ],
      "access_date": "2026-10-26"
    },
    {
      "slug": "promptfoo",
      "name": "promptfoo",
      "category": "evals",
      "url": "https://github.com/promptfoo/promptfoo",
      "extra_urls": [
        "https://www.promptfoo.dev/docs/intro/",
        "https://www.promptfoo.dev/docs/providers/ollama/",
        "https://www.promptfoo.dev/docs/providers/openrouter/"
      ],
      "license": "MIT",
      "kind": "eval + red-team CLI (Node)",
      "loop": "Deterministic",
      "what": "Node CLI for declarative prompt, agent and RAG tests with deterministic assertions (equals, contains, regex, is-json, JSON schema, JavaScript) plus model-graded checks. It has Ollama and OpenRouter providers.",
      "why": "The repo already ships templates/cicd/prompt-eval.yml for promptfoo, and the stack is Node. Drift found: that template's header says it uses 'Claude Sonnet 4 via OpenRouter as primary model', but MODEL_CONFIG.md denylists the Sonnet family. Re-point it to allowed profiles or to the Ollama provider on a self-hosted runner.",
      "determinism": "Deterministic assertions (is-json, regex, schema) are exact. Model-graded assertions are not, so use them only as soft signals or with a jury.",
      "effort": "low",
      "priority": "high",
      "adopt": [
        "Fix prompt-eval.yml's model to an allowed profile.",
        "Add schema assertions that reuse schemas/*.schema.json.",
        "Run a local-lane suite via the Ollama provider on a self-hosted runner."
      ],
      "access_date": "2026-10-26"
    },
    {
      "slug": "qwen3-4b-instruct-2507",
      "name": "Qwen3-4B-Instruct-2507",
      "category": "local-models",
      "url": "https://huggingface.co/Qwen/Qwen3-4B-Instruct-2507",
      "extra_urls": [
        "https://ollama.com/library/qwen3"
      ],
      "license": "Apache-2.0",
      "kind": "open-weight model",
      "loop": "Generative",
      "what": "4.0B-parameter instruct model, non-thinking mode only (no <think> blocks), 262,144-token native context, with improved instruction following and tool use (per model card).",
      "why": "Fits the 'load a 7B-8B instruct model' Layer 0 advice in LOCAL_LLM_SETUP.md, but is smaller, so it suits a laptop. No think-blocks means cleaner structured output for WR rewrite and triage. Apache-2.0 allows commercial products, which matters for the revenue goals.",
      "determinism": "Run with a fixed seed, temperature 0 and a pinned file hash. The Qwen3 family appears on vLLM's batch-invariance validated list (Qwen3-1.7B/8B listed; this exact checkpoint is not).",
      "effort": "low",
      "priority": "high",
      "adopt": [
        "Candidate default LMSTUDIO_MODEL/OLLAMA_MODEL for triage and cheap_summary-style local work. Benchmark it against the current gemma3 default with promptfoo."
      ],
      "access_date": "2026-10-26"
    },
    {
      "slug": "mt-bench-llm-judge",
      "name": "Judging LLM-as-a-Judge with MT-Bench and Chatbot Arena + FastChat llm_judge",
      "category": "methods",
      "url": "https://arxiv.org/abs/2306.05685",
      "extra_urls": [
        "https://github.com/lm-sys/FastChat/tree/main/fastchat/llm_judge",
        "https://huggingface.co/datasets/lmsys/mt_bench_human_judgments"
      ],
      "license": "Paper: arXiv preprint (read and cite). Code: FastChat, Apache-2.0. Human-judgment dataset: CC-BY-4.0.",
      "kind": "paper + open-source judge harness + dataset",
      "loop": "Agentic",
      "what": "Zheng et al. (Jun 2023, NeurIPS 2023 Datasets and Benchmarks Track) study the usage and limits of LLM-as-a-judge, including position, verbosity and self-enhancement biases. They report that strong judges like GPT-4 reach over 80% agreement with human preferences, the same level as agreement between humans. The open FastChat llm_judge harness (gen_judgment.py) supports single-answer grading and pairwise modes, and releases the MT-bench questions, 3K expert votes and 30K human-preference conversations.",
      "why": "It names self-enhancement bias, the failure WR-4483 R1 guards against with distinct model FAMILIES, and it ships something runnable: an Apache-2.0 judge harness plus a CC-BY-4.0 human-vote set to calibrate each judge in a 2-3 family panel (WR-4486) against people before trusting its scores.",
      "determinism": "Judge prompts, questions and the human-vote set are fixed and versioned, so agreement-with-human numbers are reproducible for a pinned judge. Judge sampling is not deterministic unless run on seeded local lanes; report dispersion across judges as WR-4483 requires.",
      "effort": "medium",
      "priority": "high",
      "adopt": [
        "Cite it in WR-4483/WR-4486 as the source for self-enhancement and position bias.",
        "Swap answer order in pairwise judging (the paper's position-bias mitigation) and require both orders to agree.",
        "Score each candidate judge family (for example Qwen3, Granite, Phi) against mt_bench_human_judgments; keep only judges above an agreed agreement threshold."
      ],
      "access_date": "2026-10-26"
    },
    {
      "slug": "batch-invariant-ops",
      "name": "Defeating Nondeterminism in LLM Inference + batch_invariant_ops",
      "category": "reproducibility",
      "url": "https://thinkingmachines.ai/blog/defeating-nondeterminism-in-llm-inference/",
      "extra_urls": [
        "https://github.com/thinking-machines-lab/batch_invariant_ops"
      ],
      "license": "Blog: all rights reserved (read and cite only). Code repo: MIT",
      "kind": "research write-up + reference code",
      "loop": "Deterministic",